{
  "schema": "neuvago-typed-source-usage-v1",
  "version": "1.0.0",
  "status": "RECORDED_SOURCE_USE_NOT_CLAIM_SUPPORT",
  "input_usage_ledger_sha256": "f606633703942e1ed981fece84fd7ae0c182f770e70da49f2c72548619e96ea1",
  "usages": [
    {
      "usage_id": "USE-D927F5603713B4F8",
      "source_id": "EVD-PMID-28242739",
      "usage_scope": "CITED_SOURCE_IDENTITY_NOT_SCIENTIFIC_SUPPORT",
      "original_usage": {
        "usage_id": "USE-D927F5603713B4F8",
        "intake_id": "INTAKE-PMID-28242739",
        "reference_key": "PMID:28242739",
        "route": "/learn/fight-flight-freeze",
        "path": "src/app/(en)/learn/fight-flight-freeze/page.tsx",
        "card_id": "source-28242739",
        "source_file_sha256": "d8459d9dc6b95aaffe7adfa1b8dc0f8b8eb67f06590f8f6f4a398a3929f0fc2f",
        "source_card_locator": {
          "start_line": 567,
          "end_line": 577,
          "representation": "STATIC_TSX_ARTICLE",
          "excerpt_sha256": "573d901f2d282e6bb6dd4a846bbb73583bc8695503594fee8a980d44cf75b16c"
        },
        "source_excerpt": "<article id=\"source-28242739\" data-source-pmid=\"28242739\" className=\"min-w-0 rounded-[1.5rem] border border-black/10 bg-white/70 p-6 md:p-8\">\n              <p className=\"text-xs font-medium uppercase tracking-[0.12em] text-[#625b53]\">1. Translational review · 2017</p>\n              <h3 className=\"mt-3 break-words text-xl font-medium leading-7 text-[#1f1f1c]\">Freeze for action: neurobiological mechanisms in animal and human freezing</h3>\n              <p className=\"mt-3 text-sm leading-7 text-[#5f5a52]\">Roelofs K. Philosophical Transactions of the Royal Society B.</p>\n              <p className=\"mt-4 text-sm leading-7 text-[#5f5a52]\">Reviews animal and human research on defensive freezing and preparation for action. Freezing in this literature is not simply another word for tiredness, low motivation or emotional numbness.</p>\n              <div className=\"mt-4 flex min-w-0 flex-col gap-2 text-sm text-[#5f5a52]\">\n                <span>PMID: 28242739</span>\n                <span className=\"break-all\">DOI: 10.1098/rstb.2016.0206</span>\n              </div>\n              <a href=\"https://pubmed.ncbi.nlm.nih.gov/28242739/\" target=\"_blank\" rel=\"noopener noreferrer\" className=\"mt-5 inline-flex font-medium underline decoration-black/30 underline-offset-4 focus-visible:outline focus-visible:outline-2 focus-visible:outline-offset-4\">Read Roelofs K on PubMed</a>\n            </article>",
        "scope_preserved_verbatim": "Reviews animal and human research on defensive freezing and preparation for action. Freezing in this literature is not simply another word for tiredness, low motivation or emotional numbness.",
        "prior_accepted_display_metadata": {
          "authors": "Roelofs K",
          "year": 2017,
          "title": "Freeze for action: neurobiological mechanisms in animal and human freezing",
          "journal": "Philosophical Transactions of the Royal Society B",
          "doi": "10.1098/rstb.2016.0206",
          "kind": "Translational review",
          "scope": "Reviews animal and human research on defensive freezing and preparation for action. Freezing in this literature is not simply another word for tiredness, low motivation or emotional numbness.",
          "link": "https://pubmed.ncbi.nlm.nih.gov/28242739/",
          "existing": false
        },
        "original_usage_object": {
          "route": "/learn/fight-flight-freeze",
          "path": "src/app/(en)/learn/fight-flight-freeze/page.tsx",
          "batch": "1E.4D.3",
          "definition_marker_lines": [
            183,
            567,
            573,
            576
          ],
          "card_scope_from_accepted_contract": "Reviews animal and human research on defensive freezing and preparation for action. Freezing in this literature is not simply another word for tiredness, low motivation or emotional numbness.",
          "metadata_from_accepted_contract": {
            "authors": "Roelofs K",
            "year": 2017,
            "title": "Freeze for action: neurobiological mechanisms in animal and human freezing",
            "journal": "Philosophical Transactions of the Royal Society B",
            "doi": "10.1098/rstb.2016.0206",
            "kind": "Translational review",
            "scope": "Reviews animal and human research on defensive freezing and preparation for action. Freezing in this literature is not simply another word for tiredness, low motivation or emotional numbness.",
            "link": "https://pubmed.ncbi.nlm.nih.gov/28242739/",
            "existing": false
          },
          "source_file_sha256": "d8459d9dc6b95aaffe7adfa1b8dc0f8b8eb67f06590f8f6f4a398a3929f0fc2f"
        },
        "scope_text_preserved": true,
        "current_rendering_verified": false,
        "claim_support_approved": false
      },
      "claim_ids": [],
      "claim_support_approved": false
    },
    {
      "usage_id": "USE-B04E362BAECA694D",
      "source_id": "EVD-PMID-26062169",
      "usage_scope": "CITED_SOURCE_IDENTITY_NOT_SCIENTIFIC_SUPPORT",
      "original_usage": {
        "usage_id": "USE-B04E362BAECA694D",
        "intake_id": "INTAKE-PMID-26062169",
        "reference_key": "PMID:26062169",
        "route": "/learn/fight-flight-freeze",
        "path": "src/app/(en)/learn/fight-flight-freeze/page.tsx",
        "card_id": "source-26062169",
        "source_file_sha256": "d8459d9dc6b95aaffe7adfa1b8dc0f8b8eb67f06590f8f6f4a398a3929f0fc2f",
        "source_card_locator": {
          "start_line": 578,
          "end_line": 588,
          "representation": "STATIC_TSX_ARTICLE",
          "excerpt_sha256": "5a9d48e0727f49658266459564090497954f288a98bad3e2b07d817a37fe3e63"
        },
        "source_excerpt": "<article id=\"source-26062169\" data-source-pmid=\"26062169\" className=\"min-w-0 rounded-[1.5rem] border border-black/10 bg-white/70 p-6 md:p-8\">\n              <p className=\"text-xs font-medium uppercase tracking-[0.12em] text-[#625b53]\">2. Clinical review · 2015</p>\n              <h3 className=\"mt-3 break-words text-xl font-medium leading-7 text-[#1f1f1c]\">Fear and the Defense Cascade: Clinical Implications and Management</h3>\n              <p className=\"mt-3 text-sm leading-7 text-[#5f5a52]\">Kozlowska K, Walker P, McLean L, Carrive P. Harvard Review of Psychiatry.</p>\n              <p className=\"mt-4 text-sm leading-7 text-[#5f5a52]\">Distinguishes defensive responses including freezing and tonic or collapsed immobility. Its clinical framework is not a self-diagnosis checklist or evidence for a Neuvago treatment effect.</p>\n              <div className=\"mt-4 flex min-w-0 flex-col gap-2 text-sm text-[#5f5a52]\">\n                <span>PMID: 26062169</span>\n                <span className=\"break-all\">DOI: 10.1097/HRP.0000000000000065</span>\n              </div>\n              <a href=\"https://pubmed.ncbi.nlm.nih.gov/26062169/\" target=\"_blank\" rel=\"noopener noreferrer\" className=\"mt-5 inline-flex font-medium underline decoration-black/30 underline-offset-4 focus-visible:outline focus-visible:outline-2 focus-visible:outline-offset-4\">Read Kozlowska K on PubMed</a>\n            </article>",
        "scope_preserved_verbatim": "Distinguishes defensive responses including freezing and tonic or collapsed immobility. Its clinical framework is not a self-diagnosis checklist or evidence for a Neuvago treatment effect.",
        "prior_accepted_display_metadata": {
          "authors": "Kozlowska K, Walker P, McLean L, Carrive P",
          "year": 2015,
          "title": "Fear and the Defense Cascade: Clinical Implications and Management",
          "journal": "Harvard Review of Psychiatry",
          "doi": "10.1097/HRP.0000000000000065",
          "kind": "Clinical review",
          "scope": "Distinguishes defensive responses including freezing and tonic or collapsed immobility. Its clinical framework is not a self-diagnosis checklist or evidence for a Neuvago treatment effect.",
          "link": "https://pubmed.ncbi.nlm.nih.gov/26062169/",
          "existing": false
        },
        "original_usage_object": {
          "route": "/learn/fight-flight-freeze",
          "path": "src/app/(en)/learn/fight-flight-freeze/page.tsx",
          "batch": "1E.4D.3",
          "definition_marker_lines": [
            183,
            578,
            584,
            587
          ],
          "card_scope_from_accepted_contract": "Distinguishes defensive responses including freezing and tonic or collapsed immobility. Its clinical framework is not a self-diagnosis checklist or evidence for a Neuvago treatment effect.",
          "metadata_from_accepted_contract": {
            "authors": "Kozlowska K, Walker P, McLean L, Carrive P",
            "year": 2015,
            "title": "Fear and the Defense Cascade: Clinical Implications and Management",
            "journal": "Harvard Review of Psychiatry",
            "doi": "10.1097/HRP.0000000000000065",
            "kind": "Clinical review",
            "scope": "Distinguishes defensive responses including freezing and tonic or collapsed immobility. Its clinical framework is not a self-diagnosis checklist or evidence for a Neuvago treatment effect.",
            "link": "https://pubmed.ncbi.nlm.nih.gov/26062169/",
            "existing": false
          },
          "source_file_sha256": "d8459d9dc6b95aaffe7adfa1b8dc0f8b8eb67f06590f8f6f4a398a3929f0fc2f"
        },
        "scope_text_preserved": true,
        "current_rendering_verified": false,
        "claim_support_approved": false
      },
      "claim_ids": [],
      "claim_support_approved": false
    },
    {
      "usage_id": "USE-4A16D9C21F824CBA",
      "source_id": "EVD-PMID-17615391",
      "usage_scope": "CITED_SOURCE_IDENTITY_NOT_SCIENTIFIC_SUPPORT",
      "original_usage": {
        "usage_id": "USE-4A16D9C21F824CBA",
        "intake_id": "INTAKE-PMID-17615391",